{
  "registry_id": "core-default-application-registry-PLACEHOLDER",
  "version": "v1",
  "updated_at": "2026-05-02T20:00:00Z",
  "scope": "core_default",
  "applications": [
    {
      "application_id": "air_quality_reference_pipeline",
      "label": "Air quality reference application (AQ pipeline + decision packets)",
      "domain_id": "air_quality",
      "consumer_contracts": [
        "consumer_urban_decision_packet_core",
        "consumer_decision_packet_air_quality",
        "consumer_decision_packets_air_quality",
        "consumer_recommendation_response"
      ],
      "payload_builders": ["urban_platform.applications.air_pollution.pipeline"],
      "sdk_api_outputs_consumed": ["recommendation_response", "decision_packet_air_quality"],
      "packet_types": ["consumer_decision_packet_air_quality"],
      "field_task_types": ["consumer_field_verification_task"],
      "safety_gates_and_blocked_uses": [
        "specifications/domain_specs/air_quality.v1.yaml#safety_gates",
        "specifications/domain_specs/air_quality.v1.yaml#blocked_uses"
      ],
      "examples": [],
      "conformance_requirements": ["schema_valid", "manifest_registered", "payload_builder_tests"],
      "enabled_by_default": true,
      "status": "reference"
    },
    {
      "application_id": "flood_risk_review_console",
      "label": "Flood risk read-only review application",
      "domain_id": "flood_risk",
      "consumer_contracts": ["consumer_flood_risk_dashboard", "consumer_flood_decision_packet", "consumer_field_verification_task"],
      "payload_builders": ["urban_platform.applications.flood.dashboard_payload", "urban_platform.applications.flood.decision_packets"],
      "dashboard_component": "review_dashboard.components.flood_panel",
      "sdk_api_outputs_consumed": ["flood_risk_dashboard", "flood_decision_packet"],
      "packet_types": ["consumer_flood_decision_packet"],
      "field_task_types": ["consumer_field_verification_task"],
      "safety_gates_and_blocked_uses": [
        "specifications/domain_specs/flood_risk.v1.yaml#safety_gates",
        "specifications/domain_specs/flood_risk.v1.yaml#blocked_uses"
      ],
      "examples": ["examples/flood/flood_risk_dashboard.sample.json", "examples/flood/flood_decision_packet.sample.json"],
      "conformance_requirements": ["schema_valid", "manifest_registered", "example_valid", "payload_builder_tests", "dashboard_demo_tests"],
      "enabled_by_default": true,
      "status": "reference"
    },
    {
      "application_id": "property_buildings_open_data_review_console",
      "label": "Property/buildings open-data-first review application",
      "domain_id": "property_buildings",
      "consumer_contracts": ["consumer_property_building_dashboard", "consumer_property_building_review_packet", "consumer_field_verification_task"],
      "payload_builders": ["urban_platform.applications.property_buildings.dashboard_payload", "urban_platform.applications.property_buildings.review_packets"],
      "dashboard_component": "review_dashboard.components.property_buildings_panel",
      "sdk_api_outputs_consumed": ["property_building_dashboard", "property_building_review_packet"],
      "packet_types": ["consumer_property_building_review_packet"],
      "field_task_types": ["consumer_field_verification_task"],
      "safety_gates_and_blocked_uses": [
        "specifications/domain_specs/property_buildings.v1.yaml#open_data_inputs",
        "specifications/domain_specs/property_buildings.v1.yaml#authorized_municipal_inputs",
        "specifications/domain_specs/property_buildings.v1.yaml#blocked_uses"
      ],
      "examples": [
        "examples/property_buildings/property_building_dashboard.sample.json",
        "examples/property_buildings/property_building_review_packet.sample.json"
      ],
      "conformance_requirements": ["schema_valid", "manifest_registered", "example_valid", "payload_builder_tests", "dashboard_demo_tests"],
      "enabled_by_default": true,
      "status": "reference"
    }
  ]
}

